{
  "schema": "mdoc-proofs-v1.schema.json",
  "sha256": "e3b0c44298fc1c149afbf4c8996fb92427ae41e4649b934ca495991b7852b855",
  "provenance": {
    "type": "constructed",
    "generator": "fixture",
    "created": "2026-08-25"
  },
  "comment": "Sidecar sitting in presentations/ that names the proofs schema."
}
