{
  "schema": "mdoc-proofs-v1.schema.json",
  "prover": "synthetic",
  "circuit": "good",
  "sha256": "2a32be419201d389589bd3f1523febfc7d1adcf4ea5ec2156932e603d615925d",
  "doctype": "org.iso.18013.5.1.mDL",
  "claims": [
    {
      "namespace": "org.iso.18013.5.1",
      "id": "age_over_18",
      "cbor_value": "f5"
    }
  ],
  "transcript": "8181",
  "issuer_public_key_x": "1111111111111111111111111111111111111111111111111111111111111111",
  "issuer_public_key_y": "2222222222222222222222222222222222222222222222222222222222222222",
  "timestamp": "2026-08-21T12:00:00Z",
  "presentation": "no-such-presentation",
  "provenance": {
    "type": "repository",
    "repo": "github.com/example/fixtures",
    "ref": "abababababababababababababababababababab",
    "path": "proofs/dangling-presentation.proof",
    "captured": "2026-08-21"
  },
  "comment": "Proof vector whose presentation names no presentation vector."
}
